{
  "schemaVersion": "2.0",
  "sample": { "id": "sample-demo", "name": "Demo reaction" },
  "spectra": [
    {
      "id": "before",
      "name": "before.txt",
      "role": "before",
      "signalType": "transmittance"
    },
    {
      "id": "after",
      "name": "after.txt",
      "role": "after",
      "signalType": "transmittance"
    }
  ],
  "peakObservations": [
    {
      "id": "peak-before-1715",
      "spectrumId": "before",
      "nu": 1715.2,
      "originalNu": 1715.2,
      "prominence": 18.4,
      "widthCm1": 24.5,
      "fwhmCm1": 18.0,
      "shape": "sharp",
      "direction": "absorption",
      "detectionMethod": "automatic",
      "confidence": 0.91
    },
    {
      "id": "peak-after-1688",
      "spectrumId": "after",
      "nu": 1688.1,
      "originalNu": 1688.1,
      "prominence": 11.2,
      "widthCm1": 30.1,
      "fwhmCm1": 22.0,
      "shape": "broad",
      "direction": "absorption",
      "detectionMethod": "automatic",
      "confidence": 0.84
    }
  ],
  "peakGroups": [],
  "confirmedPeakIds": ["peak-before-1715", "peak-after-1688"],
  "analysisSettings": { "language": "ru", "reactionMode": true }
}
